{
  "schema": "uads.qpt-snapshot",
  "schemaVersion": "0.6.0",
  "projectId": "58233072c1c707ff",
  "requiredGatesTotal": 1,
  "requiredGatesSatisfiedCurrent": 1,
  "verifiedQualityCoverage": 1,
  "requiredIndependentReview": "satisfied",
  "estimatedContextTokens": 0,
  "tokenEstimateMethod": "byte-heuristic",
  "toolExecutions": 1,
  "gateExecutions": 1,
  "gateCacheHits": 0,
  "gateCacheMisses": 1,
  "avoidedWorkCount": 0,
  "contextRadius": "C1",
  "budgetUtilization": 0,
  "qptRatio": 1,
  "qptFormula": "verifiedQualityCoverage / max(1, estimatedContextTokens/1000)",
  "limitations": [
    "byte-heuristic estimates only; not provider tokenizer counts",
    "not a financial cost, latency, or billing score",
    "agentCallsReported stays null unless the host reports them",
    "estimatedDiagnosticTokens is tracked separately and is not part of the QPT denominator"
  ],
  "estimatedDiagnosticTokens": 0,
  "updatedAt": "2026-09-09T15:20:49.766Z"
}
